title,ingredients,instructions,cook_time,servings,source,url
Spaghetti alla Carbonara,320g Spaghetti | 6 Egg Yolks | As required Salt | 150g Bacon | 50g Pecorino | As required Black Pepper,"STEP 1
Put a large saucepan of water on to boil.

STEP 2
Finely chop the 100g pancetta, having first removed any rind. Finely grate 50g pecorino cheese and 50g parmesan and mix them together.

STEP 3
Beat the 3 large eggs in a medium bowl and season with a little freshly grated black pepper. Set everything aside.

STEP 4
Add 1 tsp salt to the boiling water, add 350g spaghetti and when the water comes back to the boil, cook at a constant simmer, covered, for 10 minutes or until al dente (just cooked).

STEP 5
Squash 2 peeled plump garlic cloves with the blade of a knife, just to bruise it.

STEP 6
While the spaghetti is cooking, fry the pancetta with the garlic. Drop 50g unsalted butter into a large frying pan or wok and, as soon as the butter has melted, tip in the pancetta and garlic.

STEP 7
Leave to cook on a medium heat for about 5 minutes, stirring often, until the pancetta is golden and crisp. The garlic has now imparted its flavour, so take it out with a slotted spoon and discard.

STEP 8
Keep the heat under the pancetta on low. When the pasta is ready, lift it from the water with a pasta fork or tongs and put it in the frying pan with the pancetta. Don’t worry if a little water drops in the pan as well (you want this to happen) and don’t throw the pasta water away yet.

STEP 9
Mix most of the cheese in with the eggs, keeping a small handful back for sprinkling over later.

STEP 10
Take the pan of spaghetti and pancetta off the heat. Now quickly pour in the eggs and cheese. Using the tongs or a long fork, lift up the spaghetti so it mixes easily with the egg mixture, which thickens but doesn’t scramble, and everything is coated.

STEP 11
Add extra pasta cooking water to keep it saucy (several tablespoons should do it). You don’t want it wet, just moist. Season with a little salt, if needed.

STEP 12
Use a long-pronged fork to twist the pasta on to the serving plate or bowl. Serve immediately with a little sprinkling of the remaining cheese and a grating of black pepper. If the dish does get a little dry before serving, splash in some more hot pasta water and the glossy sauciness will be revived.",,,TheMealDB,https://www.themealdb.com/images/media/meals/llcbn01574260722.jpg
Syrian Spaghetti,16 ounces Spaghetti | 8 ounces Tomato Sauce | 6 oz  Tomato Puree | 1 teaspoon Cinnamon | 1/4 cup Vegetable Oil | Dash Salt | Dash Pepper,"Preheat oven to 350 degrees F (175 degrees C). Grease a 9x13 inch baking dish.

Bring a large pot of lightly salted water to a boil. Add spaghetti and cook for 8 to 10 minutes or until al dente; drain and stir in tomato sauce, tomato paste, cinnamon, oil, salt and pepper. Transfer to prepared dish.

Bake in preheated oven for 1 hour, or until top is crunchy.",,,TheMealDB,https://www.themealdb.com/images/media/meals/5fu4ew1760524857.jpg
Venetian Duck Ragu,1 tbls Olive Oil | 4 Duck Legs | 2 finely chopped Onions | 2 cloves minced Garlic | 2 tsp ground Cinnamon | 2 tsp Plain Flour | 250ml Red Wine | 800g Chopped Tomatoes | 1 Chicken Stock Cube | 3 sprigs Rosemary | 2 Bay Leaves | 1 tsp  Sugar | 2 tbs Milk | 600g Paccheri Pasta | Grated Parmesan Cheese,"Heat the oil in a large pan. Add the duck legs and brown on all sides for about 10 mins. Remove to a plate and set aside. Add the onions to the pan and cook for 5 mins until softened. Add the garlic and cook for a further 1 min, then stir in the cinnamon and flour and cook for a further min. Return the duck to the pan, add the wine, tomatoes, stock, herbs, sugar and seasoning. Bring to a simmer, then lower the heat, cover with a lid and cook for 2 hrs, stirring every now and then.
Carefully lift the duck legs out of the sauce and place on a plate – they will be very tender so try not to lose any of the meat. Pull off and discard the fat, then shred the meat with 2 forks and discard the bones. Add the meat back to the sauce with the milk and simmer, uncovered, for a further 10-15 mins while you cook the pasta.
Cook the pasta following pack instructions, then drain, reserving a cup of the pasta water, and add the pasta to the ragu. Stir to coat all the pasta in the sauce and cook for 1 min more, adding a splash of cooking liquid if it looks dry. Serve with grated Parmesan, if you like.",,,TheMealDB,https://www.themealdb.com/images/media/meals/qvrwpt1511181864.jpg
 Bubble & Squeak,1 tbs Butter | 4 Bacon | 1 finely sliced Onion | 1 chopped Garlic Clove | 20 Brussels Sprouts | 400g Potatoes,"Melt the fat in a non-stick pan, allow it to get nice and hot, then add the bacon. As it begins to brown, add the onion and garlic. Next, add the sliced sprouts or cabbage and let it colour slightly. All this will take 5-6 mins.
Next, add the potato. Work everything together in the pan and push it down so that the mixture covers the base of the pan – allow the mixture to catch slightly on the base of the pan before turning it over and doing the same again. It’s the bits of potato that catch in the pan that define the term ‘bubble and squeak’, so be brave and let the mixture colour. Cut into wedges and serve.",,,TheMealDB,https://www.themealdb.com/images/media/meals/xusqvw1511638311.jpg
Arroz al horno (baked rice),2 tbsp Extra Virgin Olive Oil | 800g Pork belly slices | 150g Black Pudding | 100g  Bacon lardon | 1 chopped Onion | 2 Red Pepper | 1 chopped Plum Tomatoes | 8 Garlic Clove | 4 teaspoons Paprika | 1/2 teaspoon Chilli Flakes | 200g Dried white beans | 1 1/2 L  Chicken Stock | 6 parts  Thyme | 375g Paella Rice | 1 Lemon Juice,"step 1
Heat oven to 200C/180C/gas 6. Heat half the oil in a deep frying or sauté pan (or shallow casserole dish) measuring around 30cm in diameter. Over a high heat, colour the pork belly slices on each side in several batches, then transfer to a bowl. Add the remaining oil to the pan and lower the heat to medium, then add the black pudding and bacon and fry all over for several mins. Remove with a slotted spoon. Fry the onion and peppers for around 10 mins until soft and pale gold, then add the tomato and cook until soft. Add the garlic, smoked paprika and chilli flakes and cook for another 2 mins, then put the pork, black pudding and bacon back in the pan. Add the beans, stock and whichever herb you're using, and bring everything to the boil.

step 2
Sprinkle the rice around the pork belly, pushing it underneath the stock. Let the stock come to the boil again, season well, then transfer to the oven (leave it uncovered). Cook for 20 mins without stirring, then check to see how the rice is doing. The rice should be tender and the stock absorbed. If it’s not ready, put back in the oven for another 5 mins, then check again. Taste for seasoning.

step 3
Squeeze lemon juice over the top and drizzle over some extra virgin olive oil just before serving, if you like.",,,TheMealDB,https://www.themealdb.com/images/media/meals/qt4i0n1763256454.jpg
Barbecue pork buns,85g Sugar | 500g White Bread Mix | 1 tablespoon Sunflower Oil | 12 Bacon | Knob Ginger | 2 cloves chopped Garlic | 2 tablespoons Soy Sauce | 3  tablespoons Clear Honey | 3  tablespoons Tomato Puree | 1 beaten Egg,"step 1
Heat the oven to 200C/fan 180C/gas. Mix the sugar into the bread mix in a large bowl, then add water as instructed on the pack. Bring the dough together with a wooden spoon, then knead on a lightly floured surface for 5 mins until smooth. Put into a large bowl, cover with oiled cling film then leave in a warm place until doubled in size.

step 2
Meanwhile, heat the oil in a pan, then fry the bacon until crisp, about 5 mins. Add the ginger and garlic and fry for 1 min until soft, then tip in the soy, honey and tomato purée and stir well. Can be made up to 3 days ahead.

step 3
Turn out the dough and knead briefly, then pull into 12 even-sized balls. Flatten with your hands, then put a teaspoon-size blob of the filling in the middle. Draw the dough up and pinch it closed like a purse, then turn the bun over and sit it on a large baking sheet. Cover with oiled cling film and leave to rise for about 30 mins until the dough feels pillowy. Brush with egg and bake for 20 mins until golden. Serve warm with dipping sauce. Can be frozen after second rise for up to 1 month or baked up to a day ahead and re-warmed.",,,TheMealDB,https://www.themealdb.com/images/media/meals/tzsy461763769901.jpg
BBQ Pork Sloppy Joes,2 Potatoes | 1 Red Onions | 2 cloves Garlic | 1 Lime | 2 Bread | 1 lb Pork | Barbeque Sauce | Hotsauce | Tomato Ketchup | Sugar | Vegetable Oil | Salt | Pepper,"1

Preheat oven to 450 degrees. Wash and dry all produce. Cut sweet potatoes into ½-inch-thick wedges. Toss on a baking sheet with a drizzle of oil, salt, and pepper. Roast until browned and tender, 20-25 minutes.

2

Meanwhile, halve and peel onion. Slice as thinly as possible until you have ¼ cup (½ cup for 4 servings); finely chop remaining onion. Peel and finely chop garlic. Halve lime; squeeze juice into a small bowl. Halve buns. Add 1 TBSP butter (2 TBSP for 4) to a separate small microwave-safe bowl; microwave until melted, 30 seconds. Brush onto cut sides of buns.

3

To bowl with lime juice, add sliced onion, ¼ tsp sugar (½ tsp for 4 servings), and a pinch of salt. Stir to combine; set aside to quick-pickle.

4

Heat a drizzle of oil in a large pan over medium-high heat. Add chopped onion and season with salt and pepper. Cook, stirring, until softened, 4-5 minutes. Add garlic and cook until fragrant, 30 seconds more. Add pork and season with salt and pepper. Cook, breaking up meat into pieces, until browned and cooked through, 4-6 minutes.

5

While pork cooks, in a third small bowl, combine BBQ sauce, pickling liquid from onion, 3 TBSP ketchup (6 TBSP for 4 servings), ½ tsp sugar (1 tsp for 4), and ¼ cup water (⅓ cup for 4). Once pork is cooked through, add BBQ sauce mixture to pan. Cook, stirring, until sauce is thickened, 2-3 minutes. Taste and season with salt and pepper.

6

Meanwhile, toast buns in oven or toaster oven until golden, 3-5 minutes. Divide toasted buns between plates and fill with as much BBQ pork as you’d like. Top with pickled onion and hot sauce. Serve with sweet potato wedges on the side.",,,TheMealDB,https://www.themealdb.com/images/media/meals/atd5sh1583188467.jpg
Bigos (Hunters Stew),2 sliced Bacon | 1 lb Kielbasa | 1 lb Pork | 1/4 cup Flour | 3 chopped Garlic | 1 Diced Onion | 1 1/2 cup  Mushrooms | 4 cups  Cabbage | 1 Jar Sauerkraut | 1/4 cup Red Wine | 1 Bay Leaf | 1 tsp  Basil | 1 tsp  Marjoram | 1 tbs Paprika | 1/8 teaspoon Caraway Seed | 1 dash Hotsauce | 5 Cups Beef Stock | 2 tbs Tomato Puree | 1 cup  Diced Tomatoes | 1 dash Worcestershire Sauce,"Preheat the oven to 350 degrees F (175 degrees C).

Heat a large pot over medium heat. Add the bacon and kielbasa; cook and stir until the bacon has rendered its fat and sausage is lightly browned. Use a slotted spoon to remove the meat and transfer to a large casserole or Dutch oven.

Coat the cubes of pork lightly with flour and fry them in the bacon drippings over medium-high heat until golden brown. Use a slotted spoon to transfer the pork to the casserole. Add the garlic, onion, carrots, fresh mushrooms, cabbage and sauerkraut. Reduce heat to medium; cook and stir until the carrots are soft, about 10 minutes. Do not let the vegetables brown.

Deglaze the pan by pouring in the red wine and stirring to loosen all of the bits of food and flour that are stuck to the bottom. Season with the bay leaf, basil, marjoram, paprika, salt, pepper, caraway seeds and cayenne pepper; cook for 1 minute.

Mix in the dried mushrooms, hot pepper sauce, Worcestershire sauce, beef stock, tomato paste and tomatoes. Heat through just until boiling. Pour the vegetables and all of the liquid into the casserole dish with the meat. Cover with a lid.

Bake in the preheated oven for 2 1/2 to 3 hours, until meat is very tender.",,,TheMealDB,https://www.themealdb.com/images/media/meals/md8w601593348504.jpg
Boxty Breakfast,4 large Potatoes | 1  bunch Spring Onions | 100g  Plain Flour | 1 Egg White | 150ml Milk | 1 tsp  Bicarbonate Of Soda | 3 tbs Butter | 2 tbs Vegetable Oil | 6 Cherry Tomatoes | 12 Bacon | 6 Egg,"STEP 1
Before you start, put your oven on its lowest setting, ready to keep things warm. Peel the potatoes, grate 2 of them, then set aside. Cut the other 2 into large chunks, then boil for 10-15 mins or until tender. Meanwhile, squeeze as much of the liquid from the grated potatoes as you can using a clean tea towel. Mash the boiled potatoes, then mix with the grated potato, spring onions and flour.

STEP 2
Whisk the egg white in a large bowl until it holds soft peaks. Fold in the buttermilk, then add the bicarbonate of soda. Fold into the potato mix.

STEP 3
Heat a large non-stick frying pan over a medium heat, then add 1 tbsp butter and some of the oil. Drop 3-4 spoonfuls of the potato mixture into the pan, then gently cook for 3-5 mins on each side until golden and crusty. Keep warm on a plate in the oven while you cook the next batch, adding more butter and oil to the pan before you do so. You will get 16 crumpet-size boxty from the mix. Can be made the day ahead, drained on kitchen paper, then reheated in a low oven for 20 mins.

STEP 4
Heat the grill to medium and put the tomatoes in a heavy-based pan. Add a good knob of butter and a little oil, then fry for about 5 mins until softened. Grill the bacon, then pile onto a plate and keep warm. Stack up the boxty, bacon and egg, and serve the tomatoes on the side.",,,TheMealDB,https://www.themealdb.com/images/media/meals/naqyel1608588563.jpg
Bryndzové Halušky,500g Potatoes | 200g Plain Flour | 1 Egg | 1 teaspoon Salt | 250g Bryndza cheese | 200g Bacon | Garnish Chives,"1. Prepare the Dough
Grate the potatoes finely using a hand grater or food processor. Place the grated potatoes in a bowl and mix them with flour, egg, and salt until a sticky dough forms. The consistency should be thick but pliable.

2. Cook the Dumplings
Bring a large pot of salted water to a boil. Using a halušky maker (similar to a spaetzle maker), press the dough directly into the boiling water. If you don’t have one, use a tilted cutting board and a knife to scrape small pieces of dough into the water.

Let the dumplings cook until they float to the surface, usually within 2-3 minutes. Scoop them out with a slotted spoon and set aside in a large bowl.

3. Prepare the Toppings
Chop the bacon into small pieces and fry in a skillet over medium heat until crispy. If using a bryndza substitute, mix crumbled feta with a dollop of sour cream to mimic the tangy flavour of traditional Slovak sheep cheese.

4. Assemble the Dish
Toss the cooked dumplings with the bryndza cheese (or substitute) until they’re well-coated and creamy. Top with the crispy bacon and its drippings. Garnish with chopped chives or parsley for an extra touch of colour and flavour.",,,TheMealDB,https://www.themealdb.com/images/media/meals/g33c901763365484.jpg
Cassava pizza,6 cut thick slices Casabe | 450g Tomato Sauce | 225g Chorizo | 225g Turkey Ham | 75g Sweetcorn | 40g Green Olives | 55g Paprika | 50g Mozzarella,"Preheat the oven to 200ºC.
Cut the bacon or chorizo into medium pieces and the paprika into strips.
Spread a little tomato sauce and mozzarella cheese on each portion of cassava.
Add the bacon or chorizo, corn, turkey ham, some olives and paprika.
Bake for 7 to 10 minutes.
Remove from the oven and enjoy.",,,TheMealDB,https://www.themealdb.com/images/media/meals/lrfdwz1764438393.jpg
"Chickpea, chorizo & spinach stew",4 tablespoons Extra Virgin Olive Oil | 1 chopped Onion | 1 Diced Carrots | 1 Diced Celery | 3 Thyme | 2 Bay Leaves | 2 cloves chopped Garlic | 200g Chorizo | 1/4 tsp Cinnamon | 1 teaspoon Paprika | 800g Chickpeas | 2 tblsp  Sherry vinegar | 400g Spinach,"step 1
Heat the oil in a large pan, then gently fry the onion for 3-4 mins until it begins to soften. Stir in the carrot, celery, thyme and bay leaves. Season, then cook for 2-3 mins, stirring occasionally. Add the garlic, chorizo, cinnamon and smoked paprika. Gently fry until the vegetables soften and the chorizo starts to release its oils and crisp up.

step 2
Stir in the chickpeas, vinegar and 150ml water, then bring to a simmer for 1-2 mins until the chickpeas have heated up. Add the spinach, then stir through the chickpeas until it wilts a little. Remove from the heat, season to taste, then serve warm with crusty bread.",,,TheMealDB,https://www.themealdb.com/images/media/meals/xvnx8j1763287209.jpg
Choripán,4 Chorizo | 4 Crusty Bread | Drizzle Chimichurri sauce,"Grill the Chorizos: Cook the chorizos on a grill or pan until fully cooked, about 10-15 minutes.
Prepare the Rolls: Slice the rolls and toast them lightly on the grill or in a pan.
Assemble: Slice each chorizo lengthwise and place in a roll. Top with a generous amount of chimichurri sauce.
Serve: Enjoy immediately while hot.
Pro Tips:

Grill the chorizo slowly on medium heat to prevent the skin from bursting and to ensure it cooks evenly throughout.
Toast the bread on the grill to absorb some of the chorizo's flavors.",,,TheMealDB,https://www.themealdb.com/images/media/meals/5i25sg1763075353.jpg
Arroz con gambas y calamar,24 Raw King Prawns | 2 tbsp Olive Oil | 1 small Onion | 1 Bay Leaf | 1 pinch Saffron | 450g Paella Rice | 2 teaspoons Tomato Puree | 200ml White Wine | 650ml Seafood stock | 3 Medium Squid,"step 1
Peel and devein most of the prawns (a fishmonger should be able to do this for you), keeping a few whole for decoration, if you like. Heat the olive oil in a large frying pan or shallow flameproof casserole over a medium-low heat and fry the onion for 5 mins until softened. Add the bay leaf, saffron, rice and tomato purée, and cook for 1-2 mins more, stirring.

step 2
Pour in the wine and bubble for 1-2 mins, then pour in the seafood stock and 150ml water. Cook for 5 mins, then add the squid, season well and stir to combine. Bring to the boil, then cover and reduce the heat to a gentle simmer. Cook for 12 mins more, adding a little more water if the mixture starts to look dry.

step 3
Uncover the pan and stir through the peeled prawns, then arrange any whole prawns on top of the rice mixture. Cover again and simmer for a further 5-6 mins until the prawns are pink and cooked through. Leave to stand for a couple of minutes before serving from the pan.",,,TheMealDB,https://www.themealdb.com/images/media/meals/jc6oub1763196663.jpg
Baked salmon with fennel & tomatoes,2 medium Fennel | 2 tbs chopped Parsley | Juice of 1 Lemon | 175g Cherry Tomatoes | 1 tbs Olive Oil | 350g Salmon | to serve Black Olives,"Heat oven to 180C/fan 160C/gas 4. Trim the fronds from the fennel and set aside. Cut the fennel bulbs in half, then cut each half into 3 wedges. Cook in boiling salted water for 10 mins, then drain well. Chop the fennel fronds roughly, then mix with the parsley and lemon zest.

Spread the drained fennel over a shallow ovenproof dish, then add the tomatoes. Drizzle with olive oil, then bake for 10 mins. Nestle the salmon among the veg, sprinkle with lemon juice, then bake 15 mins more until the fish is just cooked. Scatter over the parsley and serve.",,,TheMealDB,https://www.themealdb.com/images/media/meals/1548772327.jpg
Bang bang prawn salad,140g Rice Noodles | 3 tablespoons Peanut Butter | 4 tablespoons Coconut Milk | 3  tablespoons sweet chilli sauce | 3 sliced thinly Spring Onions | 1 sliced Cucumber | 300g Bean Sprouts | 200g Prawns,"step 1
Cook the noodles following pack instructions, then rinse under cold water and drain thoroughly. In a small saucepan melt together the peanut butter, coconut milk, sweet chilli sauce and half the spring onions, adding 1-2 tbsp of water to loosen the mixture to a drizzling consistency.

step 2
Mix the noodles, cucumber and beansprouts in a serving dish. Top with the prawns, drizzle over the peanut sauce and scatter over the remaining spring onions.",,,TheMealDB,https://www.themealdb.com/images/media/meals/4xcfai1763765676.jpg
Barramundi with Moroccan spices,2 x 400g barramundi | 1/2 teaspoon Ground Cumin | 1/2 tsp Coriander | Pinch Paprika | Pinch Chili Powder | 2 Garlic Clove | Juice of 1 Lemon | 5 tablespoons Olive Oil | Bunch Coriander,"step 1
Tip all the dressing ingredients into a food processor with a pinch of salt and blitz to a dressing. Slash the fish three times on each side, coat with half of the dressing, then set aside to marinate for about 30 mins.

step 2
Heat oven to 220C/fan 200C/gas 7. Place the fish on a roasting tray, then cook in the oven for 20 mins until the flesh is firm and the eyes have turned white. Serve the fish with the rest of the dressing and steamed couscous or rice.

step 3
KNOW HOW: HOW TO COOK IT: Cooking barramundi on the bone, as we have done here, has its advantages – it will stay more moist during cooking, and some would say that the flavour is enhanced, too. If you want to take out the bones they are easy to locate and less likely to be lodged in the fillet if the fish is cooked whole. Fillets can be simply pan-fried or grilled. If you like trout, you will really enjoy the flavour of barramundi, which lends itself to similar ingredients and cooking methods – citrus flavours are particularly good, as are garlic and wild mushrooms. Simply roasting the fish with some fresh herbs, olive oil and seasoning is delicious, and in the summer months you could barbecue it, too. One thing that you mustn’t miss are the cheeks or ‘pearls’ of the fish, these are simply lovely, moist and really sweet – well worth leaving the head on for!",,,TheMealDB,https://www.themealdb.com/images/media/meals/4o4wh11761848573.jpg
