title,ingredients,instructions,cook_time,servings,source,url
Algerian Kefta (Meatballs),1 lb Ground Beef | 4 Cloves Crushed Garlic | 1/2 cup Onion | To taste Salt | To taste Pepper | 3 Plum Tomatoes | 1 tsp Parsley | 1/2 cup Water,"Combine ground beef with 1/2 of the minced garlic and 1 tablespoon chopped onion in a large bowl. Mix with your hands until fully incorporated. Shape meat mixture into 1 1/2-inch oblong patties; you should have 12 to 14 meatballs.

Heat a large skillet over medium-high heat. Brown patties in batches in the hot skillet until crispy on both sides and no longer pink in the center, about 10 minutes. Set meatballs aside in a rimmed serving dish.

Reduce heat to medium and stir remaining chopped onion into drippings in the skillet. Season with salt and pepper. Cook, stirring constantly, until onion has softened and turned translucent, about 5 minutes. Stir in remaining garlic and cook for 30 seconds. Stir in Roma tomatoes, dried parsley, and ras el hanout. Pour in water. Cook until tomatoes are soft, about 5 minutes.

Pour tomato sauce over meatballs to serve.",,,TheMealDB,https://www.themealdb.com/images/media/meals/8rfd4q1764112993.jpg
Arepa Pabellón,2 Corn Arepa Filled With Mozarella Cheese | 1 Fried Ripe Bananas | 1 Can Black Beans | 1 Pico De Gallo Sauce | 2kg Shredded Meat | 1 chopped Tomato | Pinch Salt | Pinch Pepper,"Prepare the meat in a skillet and add salt and pepper to taste, heat the beans over medium heat in a pan, fry or grill the ripe plantains as indicated on its package and cut the tomato into small cubes. Reserve these ingredients until filling. 
Preheat the grill or pan and grill the arepa, putting it once on each side until they are golden brown. 
With the help of a knife, open it by the edge through the middle, creating a space to fill it with the ripe plantain, the beans, meat and chopped tomato. 
Serve with a little pico de gallo or guacamole dip sauce. ",,,TheMealDB,https://www.themealdb.com/images/media/meals/13fg4j1764441982.jpg
Arepa pelua,500g Beef | 1 Onion | 1 Red Pepper | 2 cloves Garlic | 1 tsp Cumin | 1 tsp Oregano | 1 tsp Paprika | 1 L  Beef Stock | 2 1/2 cups  Water | Pinch Salt | 200g Cheese | Pinch Extra Virgin Olive Oil,"Cook the meat: Place the flank steak in a pot with broth or water and salt. Cook over low heat for about 2 hours, until tender and easy to shred.
Shred the meat: Once cooked, drain and shred the meat using two forks.
Prepare the vegetables: Sauté chopped onion, bell pepper, and garlic in a little oil. Add cumin, oregano, paprika, and salt. Stir in the meat and cook for a few minutes until the flavors are well combined.
Make the dough: In a bowl, mix the cornmeal with warm water and salt until a soft dough forms. Let it rest for 5 minutes.
Form the arepas: Divide the dough into 6 portions, shape into balls, and flatten into thick discs.
Cook: Cook the arepas on a griddle or skillet over medium heat for 2–3 minutes on each side until golden. You can then bake them for a few minutes if you prefer them crispier.
Fill: Slice the arepas open on one side, fill with the hot shredded beef, and top with grated cheese.",,,TheMealDB,https://www.themealdb.com/images/media/meals/jgl9qq1764437635.jpg
Asado,2kg Mixed Beef Cuts | 4 Chorizo | 2 Morcilla | To taste Salt,"Prepare the Fire: Start a wood fire in your grill and let it burn down to coals.
Season the Meat: Generously salt the beef cuts.
Grill the Meat: Place the beef on the grill, starting with the thickest cuts farthest from the coals. Add chorizo and morcilla after the beef has been cooking for a while.
Cook to Perfection: Cook the meat, turning occasionally, until it reaches your desired doneness. Typically, ribs may take up to 2 hours; thinner cuts will cook faster.
Rest and Serve: Let the meat rest for about 10 minutes before slicing. Serve with chimichurri sauce and grilled vegetables.
Pro Tips:

Use a mix of wood and charcoal for a consistent heat source. Wood adds flavor, while charcoal maintains temperature.
Season the meat just before grilling to ensure it retains its moisture and flavor.
Serving Suggestions:

Serve with a side of chimichurri sauce, a fresh tomato salad, and crusty bread. Pair with a robust Malbec wine to complement the rich flavors of the meat.",,,TheMealDB,https://www.themealdb.com/images/media/meals/kgfh3q1763075438.jpg
Aussie Burgers,500g Lean Minced Steak | 100g  Cooked Beetroot | 2 small Naan Bread | 50g Rocket | 4 tablespoons Soured cream and chive dip,"step 1
Make the burgers: Tip the meat into a bowl and sprinkle over 1 tsp salt and a good grinding of black pepper.Work with wet hands to mix in the seasoning. Divide into four with your hands and shape into burgers. (It can be frozen at this stage.)

step 2
Sort out your ingredients: Slice the beetroot and split the naan breads.

step 3
Toast the naans: Heat a griddle pan or barbecue. Griddle the naans on both sides until lightly toasted and set aside. Add the burgers to the grill or barbecue and cook for 2-3 minutes, then turn and cook the other side for a further 2-3 minutes.

step 4
Assemble the dish: Set half a toasted naan on each serving plate and put a pile of rocket on each. Top with a burger, then a few slices of beetroot and a dollop of soured cream. Sprinkle with salt and freshly ground black pepper and serve immediately with a big green salad and chips. A glass of red wine wouldn’t go amiss, either.",,,TheMealDB,https://www.themealdb.com/images/media/meals/44bzep1761848278.jpg
Beef and Broccoli Stir-Fry,1 tsp Soy Sauce | 1 tsp Dry sherry | 1/2 tsp Cornstarch | 1/8 teaspoon Black Pepper | 1 lb Sirloin steak | 2 tablespoons Oyster Sauce | 1 tsp Dry sherry | 1 tablespoon Soy Sauce | 1/4 cup Chicken Stock | 1 lb Broccoli | 2 tablespoons High Heat Cooking Oil | 2 cloves minced Garlic | 1 tsp Cornstarch | 1 tablespoon Water,"Marinate the beef:
Stir together the beef marinade ingredients (1 teaspoon soy sauce, 1 teaspoon Chinese rice wine, 1/2 teaspoon cornstarch, 1/8 teaspoon black pepper) in a medium bowl.

Add the beef slices and stir until coated. Let stand for 10 minutes.

Prepare the sauce:
Stir together the sauce ingredients (2 tablespoons oyster sauce, 1 teaspoon Chinese rice wine, 1 teaspoon soy sauce, 1/4 cup chicken broth) in a small bowl. Set aside.

Blanch or steam the broccoli:
Bring a pot of water to a boil. Add the broccoli and cook until crisp-tender, about 2 minutes. Drain thoroughly.

Stir-fry the beef:
Heat a large frying pan or wok over high heat until a bead of water sizzles and instantly evaporates upon contact. Add the cooking oil and swirl to coat.

Add the beef and immediately spread it out all over the surface of the wok or pan in a single layer (preferably not touching).

Let the beef fry undisturbed for 1 minute. Flip the beef slices over, add the garlic to the pan, and fry for an additional 30 seconds to 1 minute until no longer pink.

Add the sauce, cornstarch, and broccoli:
Pour in the sauce and the cornstarch slurry (1 teaspoon cornstarch dissolved in 1 tablespoon of water). Stir until the sauce boils and thickens, about 30 seconds. Stir in the broccoli.

Serve immediately, with steamed rice or on its own.",,,TheMealDB,https://www.themealdb.com/images/media/meals/m0p0j81765568742.jpg
Beef and Mustard Pie,1kg Beef | 2 tbs Plain Flour | 2 tbs Rapeseed Oil | 200ml Red Wine | 400ml Beef Stock | 1 finely sliced Onion | 2 chopped Carrots | 3 sprigs Thyme | 2 tbs Mustard | 2 free-range Egg Yolks | 400g Puff Pastry | 300g Green Beans | 25g Butter | pinch Salt | pinch Pepper,"Preheat the oven to 150C/300F/Gas 2.
Toss the beef and flour together in a bowl with some salt and black pepper.
Heat a large casserole until hot, add half of the rapeseed oil and enough of the beef to just cover the bottom of the casserole.
Fry until browned on each side, then remove and set aside. Repeat with the remaining oil and beef.
Return the beef to the pan, add the wine and cook until the volume of liquid has reduced by half, then add the stock, onion, carrots, thyme and mustard, and season well with salt and pepper.
Cover with a lid and place in the oven for two hours.
Remove from the oven, check the seasoning and set aside to cool. Remove the thyme.
When the beef is cool and you're ready to assemble the pie, preheat the oven to 200C/400F/Gas 6.
Transfer the beef to a pie dish, brush the rim with the beaten egg yolks and lay the pastry over the top. Brush the top of the pastry with more beaten egg.
Trim the pastry so there is just enough excess to crimp the edges, then place in the oven and bake for 30 minutes, or until the pastry is golden-brown and cooked through.
For the green beans, bring a saucepan of salted water to the boil, add the beans and cook for 4-5 minutes, or until just tender.
Drain and toss with the butter, then season with black pepper.
To serve, place a large spoonful of pie onto each plate with some green beans alongside.",,,TheMealDB,https://www.themealdb.com/images/media/meals/sytuqu1511553755.jpg
Beef and Oyster pie,900g Beef | 3 tbs Olive Oil | 3 Shallots | 2 cloves minced Garlic | 125g Bacon | 1 tbs chopped Thyme | 2 Bay Leaf | 330ml Stout | 400ml Beef Stock | 2 tbs Corn Flour | 8 Oysters | 400g Plain Flour | pinch Salt | 250g Butter | To Glaze Eggs,"Season the beef cubes with salt and black pepper. Heat a tablespoon of oil in the frying pan and fry the meat over a high heat. Do this in three batches so that you don’t overcrowd the pan, transferring the meat to a large flameproof casserole dish once it is browned all over. Add extra oil if the pan seems dry.
In the same pan, add another tablespoon of oil and cook the shallots for 4-5 minutes, then add the garlic and fry for 30 seconds. Add the bacon and fry until slightly browned. Transfer the onion and bacon mixture to the casserole dish and add the herbs.
Preheat the oven to 180C/350F/Gas 4.
Pour the stout into the frying pan and bring to the boil, stirring to lift any stuck-on browned bits from the bottom of the pan. Pour the stout over the beef in the casserole dish and add the stock. Cover the casserole and place it in the oven for 1½-2 hours, or until the beef is tender and the sauce is reduced.
Skim off any surface fat, taste and add salt and pepper if necessary, then stir in the cornflour paste. Put the casserole dish on the hob – don’t forget that it will be hot – and simmer for 1-2 minutes, stirring, until thickened. Leave to cool.
Increase the oven to 200C/400F/Gas 6. To make the pastry, put the flour and salt in a very large bowl. Grate the butter and stir it into the flour in three batches. Gradually add 325ml/11fl oz cold water – you may not need it all – and stir with a round-bladed knife until the mixture just comes together. Knead the pastry lightly into a ball on a lightly floured surface and set aside 250g/9oz for the pie lid.
Roll the rest of the pastry out until about 2cm/¾in larger than the dish you’re using. Line the dish with the pastry then pile in the filling, tucking the oysters in as well. Brush the edge of the pastry with beaten egg.
Roll the remaining pastry until slightly larger than your dish and gently lift over the filling, pressing the edges firmly to seal, then trim with a sharp knife. Brush with beaten egg to glaze. Put the dish on a baking tray and bake for 25-30 minutes, or until the pastry is golden-brown and the filling is bubbling.",,,TheMealDB,https://www.themealdb.com/images/media/meals/wrssvt1511556563.jpg
Beef Asado,1.5kg Beef | 1 Beef Stock Concentrate | 8 ounces Tomato Puree | 3 cups  Water | 6 tablespoons Soy Sauce | 1 tbs White Wine Vinegar | 2 tbs Pepper | 4 Bay Leaf | 1/2  Lemon | 2 tbs Tomato Sauce | 3 tbs Butter | 1/2 cup  Olive Oil | 1 chopped Onion | 4 cloves Garlic,"0.	Combine beef, crushed peppercorn, soy sauce, vinegar, dried bay leaves, lemon, and tomato sauce. Mix well. Marinate beef for at least 30 minutes.
1.	Put the marinated beef in a cooking pot along with remaining marinade. Add water. Let boil.
2.	Add Knorr Beef Cube. Stir. Cover the pot and cook for 40 minutes in low heat.
3.	Turn the beef over. Add tomato paste. Continue cooking until beef tenderizes. Set aside.
4.	Heat oil in a pan. Fry the potato until it browns. Turn over and continue frying the opposite side. Remove from the pan and place on a clean plate. Do the same with the carrots.
5.	Save 3 tablespoons of cooking oil from the pan where the potato was fried. Saute onion and garlic until onion softens.
6.	Pour-in the sauce from the beef stew. Let boil. Add the beef. Cook for 2 minutes.
7.	Add butter and let it melt. Continue cooking until the sauce reduces to half.",,,TheMealDB,https://www.themealdb.com/images/media/meals/pkopc31683207947.jpg
"Beef Banh Mi Bowls with Sriracha Mayo, Carrot & Pickled Cucumber",White Rice | 1 Onion | 1 Lime | 3 Garlic Clove | 1 Cucumber | 3 oz  Carrots | 1 lb Ground Beef | 2 oz  Soy Sauce,"Add'l ingredients: mayonnaise, siracha

1

Place rice in a fine-mesh sieve and rinse until water runs clear. Add to a small pot with 1 cup water (2 cups for 4 servings) and a pinch of salt. Bring to a boil, then cover and reduce heat to low. Cook until rice is tender, 15 minutes. Keep covered off heat for at least 10 minutes or until ready to serve.

2

Meanwhile, wash and dry all produce. Peel and finely chop garlic. Zest and quarter lime (for 4 servings, zest 1 lime and quarter both). Trim and halve cucumber lengthwise; thinly slice crosswise into half-moons. Halve, peel, and medium dice onion. Trim, peel, and grate carrot.

3

In a medium bowl, combine cucumber, juice from half the lime, ¼ tsp sugar (½ tsp for 4 servings), and a pinch of salt. In a small bowl, combine mayonnaise, a pinch of garlic, a squeeze of lime juice, and as much sriracha as you’d like. Season with salt and pepper.

4

Heat a drizzle of oil in a large pan over medium-high heat. Add onion and cook, stirring, until softened, 4-5 minutes. Add beef, remaining garlic, and 2 tsp sugar (4 tsp for 4 servings). Cook, breaking up meat into pieces, until beef is browned and cooked through, 4-5 minutes. Stir in soy sauce. Turn off heat; taste and season with salt and pepper.

5

Fluff rice with a fork; stir in lime zest and 1 TBSP butter. Divide rice between bowls. Arrange beef, grated carrot, and pickled cucumber on top. Top with a squeeze of lime juice. Drizzle with sriracha mayo.",,,TheMealDB,https://www.themealdb.com/images/media/meals/z0ageb1583189517.jpg
15-minute chicken & halloumi burgers,2 Chicken Breasts | 1 tbsp Oil | 4 tbsp Hotsauce | ½ Lemon Juice | 2 Buns | 250g Cheese | ¼ Cabbage | 2 tbsp Mayonnaise | 4 tbsp Sour Cream | 4 leaves Lettuce | 2 Red Pepper,"STEP 1

Put the chicken breasts between two pieces of baking parchment and use a rolling pin to gently bash them until they are approximately 1cm thick. Cut each chicken breast into two even pieces.

STEP 2

If you're using a frying pan, heat two frying pans over medium-high heat, with one of them containing oil. Fry the chicken in the oiled pan for 3-4 mins on each side until they are cooked through. Season the chicken, reduce the heat, drizzle in the chilli sauce and half of the lemon juice, and cook for an additional 1-2 mins until the sauce is reduced. Remove the chicken from the heat.

STEP 3

If you're using an air-fryer, preheat it to 180C for 4 mins. Add the chicken to the air-fryer and cook for 12 mins. Drizzle over the chilli sauce and half the lemon juice and cook for an additional 1-2 mins until the chicken is cooked through and the sauce is reduced. Remove the chicken and keep it warm.
STEP 4

While the chicken is cooking, toast the buns in the dry frying pan for 30 seconds. Transfer them to a plate. If you're using an air fryer, put the buns in the air fryer for 1-2 mins until they are warm. Increase the air fryer temperature to 200C. Add the halloumi to the air fryer basket and cook for 10 mins, turning halfway through, until it's golden. Toss the cabbage with the mayo and the remaining lemon juice.

STEP 5

Spoon the hummus (or dip of your choice) into the toasted buns, then top with the rocket, chilli chicken, halloumi, and peppers. Drizzle with a little more chilli sauce, spoon over the cabbage, season with black pepper, and top with the bun lids. Serve with any extra cabbage on the side or a green salad.",,,TheMealDB,https://www.themealdb.com/images/media/meals/vdwloy1713225718.jpg
Ayam Percik,6 Chicken Thighs | 16 Challots | 1 1/2  Ginger | 6 Garlic Clove | 8 Cayenne Pepper | 2 tbs Turmeric | 1 1/2  Cumin | 1 1/2  Coriander | 1 1/2  Fennel | 2 tbs Tamarind Paste | 1 can  Coconut Milk | 1 tsp  Sugar | 1 cup  Water,"In a blender, add the ingredients for the spice paste and blend until smooth.
Over medium heat, pour the spice paste in a skillet or pan and fry for 10 minutes until fragrant. Add water or oil 1 tablespoon at a time if the paste becomes too dry. Don't burn the paste. Lower the fire slightly if needed.
Add the cloves, cardamom, tamarind pulp, coconut milk, water, sugar and salt. Turn the heat up and bring the mixture to boil. Turn the heat to medium low and simmer for 10 minutes. Stir occasionally. It will reduce slightly. This is the marinade/sauce, so taste and adjust seasoning if necessary. Don't worry if it's slightly bitter. It will go away when roasting.
When the marinade/sauce has cooled, pour everything over the chicken and marinate overnight to two days.
Preheat the oven to 425 F.
Remove the chicken from the marinade. Spoon the marinade onto a greased (or aluminum lined) baking sheet. Lay the chicken on top of the sauce (make sure the chicken covers the sauce and the sauce isn't exposed or it'll burn) and spread the remaining marinade on the chicken. Roast for 35-45 minutes or until internal temp of the thickest part of chicken is at least 175 F.
Let chicken rest for 5 minutes. Brush the chicken with some of the oil. Serve chicken with the sauce over steamed rice (or coconut rice).",,,TheMealDB,https://www.themealdb.com/images/media/meals/020z181619788503.jpg
Brown Stew Chicken,1 whole Chicken | 1 chopped Tomato | 2 chopped Onions | 2 chopped Garlic Clove | 1 chopped Red Pepper | 1 chopped Carrots | 1 Lime | 2 tsp Thyme | 1 tsp  Allspice | 2 tbs Soy Sauce | 2 tsp Cornstarch | 2 cups  Coconut Milk | 1 tbs Vegetable Oil,"Squeeze lime over chicken and rub well. Drain off excess lime juice.
Combine tomato, scallion, onion, garlic, pepper, thyme, pimento and soy sauce in a large bowl with the chicken pieces. Cover and marinate at least one hour.
Heat oil in a dutch pot or large saucepan. Shake off the seasonings as you remove each piece of chicken from the marinade. Reserve the marinade for sauce.
Lightly brown the chicken a few pieces at a time in very hot oil. Place browned chicken pieces on a plate to rest while you brown the remaining pieces.
Drain off excess oil and return the chicken to the pan. Pour the marinade over the chicken and add the carrots. Stir and cook over medium heat for 10 minutes.
Mix flour and coconut milk and add to stew, stirring constantly. Turn heat down to minimum and cook another 20 minutes or until tender.",,,TheMealDB,https://www.themealdb.com/images/media/meals/sypxpx1515365095.jpg
Chick-Fil-A Sandwich,1 Chicken Breast | 1/4 cup Pickle Juice | 1 Egg | 1/4 cup Milk | 1/2 cup  Flour | 1 tbs Icing Sugar | 1/2 tsp Paprika | 1/2 tsp Salt | 1/4 tsp Black Pepper | 1/4 tsp Garlic Powder | 1/4 tsp Celery Salt | 1/2 tsp Cayenne Pepper | 1 cup  Olive Oil | 1 Sesame Seed Burger Buns,"Wrap the chicken loosely between plastic wrap and pound gently with the flat side of a meat tenderizer until about 1/2 inch thick all around.
Cut into two pieces, as even as possible.
Marinate in the pickle juice for 30 minutes to one hour (add a teaspoon of Tabasco sauce now for a spicy sandwich).
Beat the egg with the milk in a bowl.
Combine the flour, sugar, and spices in another bowl.
Dip the chicken pieces each into the egg on both sides, then coat in flour on both sides.
Heat the oil in a skillet (1/2 inch deep) to about 345-350.
Fry each cutlet for 2 minutes on each side, or until golden and cooked through.
Blot on paper and serve on toasted buns with pickle slices.",,,TheMealDB,https://www.themealdb.com/images/media/meals/sbx7n71587673021.jpg
Chicken & chorizo rice pot,1 tblsp  Oil | 1 whole Chicken | 1 Large Chopped Onion | 1 chopped Red Pepper | 3 Cloves Crushed Garlic | 225g Chorizo | 1 tblsp  Tomato Puree | 1 tablespoon chopped Thyme | 150ml White Wine | 800ml Chicken Stock | 400g Rice | 2 tbs chopped Parsley,"step 1
Heat the oil in a large flameproof casserole dish and brown the chicken pieces on all sides – you may have to do this in batches. Remove from the dish and put to one side.

step 2
Lower the heat, add the onion and pepper, and gently cook for 10 mins until softened. Add the garlic and chorizo, and cook for a further 2 mins until the chorizo has released some of its oils into the dish. Stir in the tomato purée and cook for 1 min more.

step 3
Return the chicken pieces to the dish along with the thyme, white wine and stock. Bring the liquid to a boil, cover the dish with a tight-fitting lid and lower the heat. Cook for 30 mins.

step 4
Tip in the rice and stir everything together. Cover, set over a low heat and cook for a further 15 mins, or until the rice is cooked and has absorbed most of the cooking liquid. Remove from the heat and leave the dish to sit for 10 mins to absorb any remaining liquid. Season to taste and scatter with parsley to serve.",,,TheMealDB,https://www.themealdb.com/images/media/meals/fk80jp1763280767.jpg
Chicken & mushroom Hotpot,50g Butter | 1 chopped Onion | 100g  Mushrooms | 40g Plain Flour | 1 Chicken Stock Cube | pinch Nutmeg | pinch Mustard Powder | 250g Chicken | 2 Handfuls Sweetcorn | 2 large Potatoes | 1 knob Butter,"Heat oven to 200C/180C fan/gas 6. Put the butter in a medium-size saucepan and place over a medium heat. Add the onion and leave to cook for 5 mins, stirring occasionally. Add the mushrooms to the saucepan with the onions.

Once the onion and mushrooms are almost cooked, stir in the flour – this will make a thick paste called a roux. If you are using a stock cube, crumble the cube into the roux now and stir well. Put the roux over a low heat and stir continuously for 2 mins – this will cook the flour and stop the sauce from having a floury taste.

Take the roux off the heat. Slowly add the fresh stock, if using, or pour in 500ml water if you’ve used a stock cube, stirring all the time. Once all the liquid has been added, season with pepper, a pinch of nutmeg and mustard powder. Put the saucepan back onto a medium heat and slowly bring it to the boil, stirring all the time. Once the sauce has thickened, place on a very low heat. Add the cooked chicken and vegetables to the sauce and stir well. Grease a medium-size ovenproof pie dish with a little butter and pour in the chicken and mushroom filling.

Carefully lay the potatoes on top of the hot-pot filling, overlapping them slightly, almost like a pie top.

Brush the potatoes with a little melted butter and cook in the oven for about 35 mins. The hot-pot is ready once the potatoes are cooked and golden brown.",,,TheMealDB,https://www.themealdb.com/images/media/meals/uuuspp1511297945.jpg
Chicken Alfredo Primavera,2 tablespoons Butter | 3 tablespoons Olive Oil | 5 boneless Chicken | 1 teaspoon Salt | 1 cut into 1/2-inch cubes Squash | 1 Head chopped Broccoli | 8-ounce sliced mushrooms | 1 red Pepper | 1 chopped onion | 3 cloves garlic | 1/2 teaspoon red pepper flakes | 1/2 cup white wine | 1/2 cup milk | 1/2 cup heavy cream | 1 cup grated Parmesan cheese | 16 ounces bowtie pasta | pinch Salt | pinch  Pepper | chopped Parsley,"Heat 1 tablespoon of butter and 2 tablespoons of olive oil in a large skillet over medium-high heat. Season both sides of each chicken breast with seasoned salt and a pinch of pepper. Add the chicken to the skillet and cook for 5-7 minutes on each side, or until cooked through.  While the chicken is cooking, bring a large pot of water to a boil. Season the boiling water with a few generous pinches of kosher salt. Add the pasta and give it a stir. Cook, stirring occasionally, until al dente, about 12 minutes. Reserve 1/2 cup of  pasta water before draining the pasta.  Remove the chicken from the pan and transfer it to a cutting board; allow it to rest. Turn the heat down to medium and dd the remaining 1 tablespoon of butter and olive oil to the same pan you used to cook the chicken. Add the veggies (minus the garlic) and red pepper flakes to the pan and stir to coat with the oil and butter (refrain from seasoning with salt until the veggies are finished browning). Cook, stirring often, until the veggies are tender, about 5 minutes. Add the garlic and a generous pinch of salt and pepper to the pan and cook for 1 minute.  Deglaze the pan with the white wine. Continue to cook until the wine has reduced by half, about 3 minutes. Stir in the milk, heavy cream, and reserved pasta water. Bring the mixture to a gentle boil and allow to simmer and reduce for 2-3 minutes. Turn off the heat and add the Parmesan cheese and cooked pasta. Season with salt and pepper to taste. Garnish with Parmesan cheese and chopped parsley, if desired. ",,,TheMealDB,https://www.themealdb.com/images/media/meals/syqypv1486981727.jpg
