title,ingredients,instructions,cook_time,servings,source,url
Bean & Sausage Hotpot,8 large Sausages | 1 Jar Tomato Sauce | 1200g Butter Beans | 1 tbls Black Treacle | 1 tsp  English Mustard,"In a large casserole, fry the sausages until brown all over – about 10 mins.

Add the tomato sauce, stirring well, then stir in the beans, treacle or sugar and mustard. Bring to the simmer, cover and cook for 30 mins. Great served with crusty bread or rice.",,,TheMealDB,https://www.themealdb.com/images/media/meals/vxuyrx1511302687.jpg
Callaloo Jamaican Style,1  bunch Kale | 2 strips Bacon | 3 cloves Chopped Garlic | 1 medium Onion | 1/2 tsp Paprika | 1 Sprig Thyme | 1 Tomato | 1 Red Pepper | 4 Banana | Splash Vegetable Oil,"Cut leaves and soft stems from the kale branches, them soak in a bowl of cold water for about 5-10 minutes or until finish with prep.
Proceed to slicing the onions, mincing the garlic and dicing the tomatoes. Set aside
Remove kale from water cut in chunks.
Place bacon on saucepan and cook until crispy. Then add onions, garlic, thyme, stir for about a minute or more
Add tomatoes; scotch bonnet pepper, smoked paprika. Sauté for about 2-3 more minutes.
Finally add vegetable, salt, mix well, and steamed for about 6-8 minutes or until leaves are tender. Add a tiny bit of water as needed. Adjust seasonings and turn off the heat.
Using a sharp knife cut both ends off the plantain. This will make it easy to grab the skin of the plantains. Slit a shallow line down the long seam of the plantain; peel only as deep as the peel. Remove plantain peel by pulling it back.
Slice the plantain into medium size lengthwise slices and set aside.
Coat a large frying pan with cooking oil spray. Spray the tops of the plantains with a generous layer of oil spray and sprinkle with salt, freshly ground pepper.
Let the plantains ""fry"" on medium heat, shaking the frying pan to redistribute them every few minutes.
As the plantains brown, continue to add more cooking oil spray, salt and pepper (if needed) until they have reached the desired color and texture.
Remove and serve with kale",,,TheMealDB,https://www.themealdb.com/images/media/meals/ussyxw1515364536.jpg
Chakchouka ,4 Tomatoes | 2 tbs Olive Oil | 1 Diced Onion | 1 sliced Red Pepper | 1 sliced Green Pepper | 3 Cloves Crushed Garlic | 1 tsp  Cumin | 1 tsp  Paprika | 3/4 teaspoon Salt | 1/2 teaspoon Chili Powder | 4 Eggs,"In a large cast iron skillet or sauté pan with a lid, heat oil over medium high heat. Add the onion and sauté for 2-3 minutes, until softened. Add the peppers and garlic, and sauté for an additional 3-5 minutes. Add the tomatoes, cumin, paprika, salt, and chili powder. Mix well and bring the mixture to a simmer. Reduce the heat to medium low and continue to simmer, uncovered, 10-15 minutes until the mixture has thickened to your desired consistency. (Taste the sauce at this point and adjust for salt and spice, as desired.) Using the back of a spoon, make four craters in the mixture, large enough to hold an egg. Crack one egg into each of the craters. Cover the skillet and simmer for 5-7 minutes, until the eggs have set. Serve immediately with crusty bread or pita.",,,TheMealDB,https://www.themealdb.com/images/media/meals/gpz67p1560458984.jpg
Duck Confit,Handful Sea Salt | 4 Bay Leaf | 4 cloves Garlic | Handful Thyme | 4 Duck Legs | 100ml White Wine,"The day before you want to make the dish, scatter half the salt, half the garlic and half of the herbs over the base of a small shallow dish. Lay the duck legs, skin-side up, on top, then scatter over the remaining salt, garlic and herbs. Cover the duck and refrigerate overnight. This can be done up to 2 days ahead.
Pour the wine into a saucepan that will snugly fit the duck legs in a single layer. Brush the salt off the duck legs and place them, skin-side down, in the wine. Cover the pan with a lid and place over a medium heat. As soon as the wine starts to bubble, turn the heat down to the lowest setting and cook for 2 hours, checking occasionally that the liquid is just barely simmering. (If you own a heat diffuser, it would be good to use it here.) After 2 hours, the duck legs should be submerged in their own fat and the meat should feel incredibly tender when prodded. Leave to cool.
The duck legs are now cooked and can be eaten immediately – or you can follow the next step if you like them crisp. If you are preparing ahead, pack the duck legs tightly into a plastic container or jar and pour over the fat, but not the liquid at the bottom of the pan. Cover and leave in the fridge for up to a month, or freeze for up to 3 months. The liquid you are left with makes a tasty gravy, which can be chilled or frozen until needed.
To reheat and crisp up the duck legs, heat oven to 220C/fan 200C/gas 7. Remove the legs from the fat and place them, skin-side down, in an ovenproof frying pan. Roast for 30-40 mins, turning halfway through, until brown and crisp. Serve with the reheated gravy, a crisp salad and some crisp golden ptoatoes.",,,TheMealDB,https://www.themealdb.com/images/media/meals/wvpvsu1511786158.jpg
French Lentils With Garlic and Thyme,3 tablespoons Olive Oil | 1 Onion | 2 cloves Garlic | 1 Carrots | 2 1/4 cups French Lentils | 1 teaspoon Thyme | 3 Bay Leaf | 1 tablespoon Salt | 2 sticks Celery,"Place a large saucepan over medium heat and add oil. When hot, add chopped vegetables and sauté until softened, 5 to 10 minutes.
Add 6 cups water, lentils, thyme, bay leaves and salt. Bring to a boil, then reduce to a fast simmer.
Simmer lentils until they are tender and have absorbed most of the water, 20 to 25 minutes. If necessary, drain any excess water after lentils have cooked. Serve immediately, or allow them to cool and reheat later.
For a fuller taste, use some chicken stock and reduce the water by the same amount.",,,TheMealDB,https://www.themealdb.com/images/media/meals/vwwspt1487394060.jpg
French Omelette,3 Eggs | 2 knobs Butter | 1 tsp  Parmesan | 3 chopped Tarragon Leaves | 1 tbs chopped Parsley | 1 tbs chopped Chives | 4 tbs Gruyère,"Get everything ready. Warm a 20cm (measured across the top) non-stick frying pan on a medium heat. Crack the eggs into a bowl and beat them with a fork so they break up and mix, but not as completely as you would for scrambled egg. With the heat on medium-hot, drop one knob of butter into the pan. It should bubble and sizzle, but not brown. Season the eggs with the Parmesan and a little salt and pepper, and pour into the pan.
Let the eggs bubble slightly for a couple of seconds, then take a wooden fork or spatula and gently draw the mixture in from the sides of the pan a few times, so it gathers in folds in the centre. Leave for a few seconds, then stir again to lightly combine uncooked egg with cooked. Leave briefly again, and when partly cooked, stir a bit faster, stopping while there’s some barely cooked egg left. With the pan flat on the heat, shake it back and forth a few times to settle the mixture. It should slide easily in the pan and look soft and moist on top. A quick burst of heat will brown the underside.
Grip the handle underneath. Tilt the pan down away from you and let the omelette fall to the edge. Fold the side nearest to you over by a third with your fork, and keep it rolling over, so the omelette tips onto a plate – or fold it in half, if that’s easier. For a neat finish, cover the omelette with a piece of kitchen paper and plump it up a bit with your fingers. Rub the other knob of butter over to glaze. Serve immediately.",,,TheMealDB,https://www.themealdb.com/images/media/meals/yvpuuy1511797244.jpg
Locro,500g Dried white corn | 200g Dried white beans | 300g Pumpkin | 200g Potatoes | 300g Beef | 200g Pork | 1 Chorizo | 1 chopped Onion | 1 teaspoon Paprika | To taste Salt | To taste Pepper,"Soak: Soak corn and beans overnight in water.
Cook Meats: In a large pot, brown the beef and pork. Add onions and spices, cooking until translucent.
Simmer the Stew: Add soaked corn and beans, pumpkin, potato, and enough water to cover. Simmer for 2-3 hours, until thick.
Serve: Enjoy hot, with bread on the side.
Pro Tips:

Toasting the corn slightly before adding it to the stew enhances its flavor.
Add a spoonful of paprika or a dash of cumin for an extra layer of warmth and complexity",,,TheMealDB,https://www.themealdb.com/images/media/meals/5sgsob1763196284.jpg
Migas,1 large Bread | 1 1/2 L  Olive Oil | Half Garlic | 1 Handfull Pork,"Crumble the bread into small pieces. Sprinkle with cold water, cover with a damp cloth and leave for 30 minutes.
Heat 2 tsp of olive oil in a deep pan. Add the garlic cloves separated, skins on; just make a small cut with a knife to open them and keep frying for 5 minutes. Set the garlic aside.
In the same oil, where we fried everything, simmer the bread, stirring constantly for 15 minutes and add a grinding of black pepper.
Add the garlic, continue stirring for about 20 minutes. It will be ready when the bread is soft and golden.",,,TheMealDB,https://www.themealdb.com/images/media/meals/xd9aj21740432378.jpg
Mutabbaq,500g Mincemeat | 1.5 tbs minced Garlic | 1.5 tbs minced Ginger | 1 Egg | 1 large Tomato | 4 Spring Onions | 12 Filo Pastry | 1 1/2 cups  Melted Butter | 1 tsp Salt | 1 tsp Paprika | 1 tsp Cumin | 1 tsp Allspice | 1 tsp Turmeric | 1 tsp Black Pepper | 1 tsp Sugar,"1
Heat the frying pan and add in some oil. Fry the mashed garlic and ginger first and then add in the minced meat and all seasoning. When the meat is cooked, set aside to cool down.
2
Get another big bowl. Add in egg, chopped tomato, chopped spring onion and minced meat.
3
Get one 2 sheets of filo pastry or 1 sheet spring roll wrap. Brush it with some butter and then put some filling in the middle. Fold the pastry and brush more butter on the seal part.
4
Heat a frying pan and add in some oil to cook the parcel until its both sides and 4 edges all turn into golden brown. (Or brush melted butter all over the parcel and bake it in 180°C oven for 10-15 minutes)
5
Enjoy 

",,,TheMealDB,https://www.themealdb.com/images/media/meals/i5o2b61763739053.jpg
Osso Buco alla Milanese,4 meaty shanks Veal | ½ cup Flour | 2 tablespoons  Olive Oil | 3 tablespoons Butter | 1 medium chopped into ½-inch pieces Onion | 1 chopped into ½-inch pieces Carrots | 1 chopped into ½-inch pieces Celery | 1 bulb chopped into ½-inch pieces Fennel | 3 cloves Garlic | 2 strips Orange Zest | 1 ½ teaspoons Marjoram | 1 Bay Leaf | 1 cup Dry White Wine | ½ cup  Chicken Stock | 1 cup chopped with juice Tomatoes | 2 tablespoons chopped Parsley | 1 teaspoon minced Garlic | 1 teaspoon grated  Lemon Zest,"Heat the oven to 300 degrees.
Dredging the shanks: pour the flour into a shallow dish (a pie plate works nicely). Season the veal shanks on all sides with salt and pepper. One at a time, roll the shanks around in the flour coat, and shake and pat the shank to remove any excuses flour. Discard the remaining flour.
Browning the shanks: put the oil and 1 tablespoon of the butter in a wide Dutch oven or heavy braising pot (6 to 7 quart) and heat over medium-high heat. When the butter has melted and the oil is shimmering, lower the shanks into the pot, flat side down; if the shanks won’t fit without touching one another, do this in batches. Brown the shanks, turning once with tongs, until both flat sides are well caramelized, about 5 minutes per side. If the butter-oil mixture starts to burn, lower the heat just a bit. Transfer the shanks to a large platter or tray and set aside.
The aromatics: pour off and discard the fat from the pot. Wipe out any burnt bits with a damp paper towel, being careful not to remove any delicious little caramelized bits. Ad the remaining 2 tablespoons butter to the pot and melt it over medium heat. When the butter has stopped foaming, add the onion, carrot, celery, and fennel. Season with salt and pepper, stir, and cook the vegetables until they begin to soften but do not brown, about 6 minutes. Stir in the garlic, orange zest, marjoram, and bay leaf, and stew for another minute or two.
The braising liquid: add the wine, increase the heat to high, and bring to a boil. Boil, stirring occasionally, to reduce the wine by about half, 5 minutes. Add the stock and tomatoes, with their juice, and boil again to reduce the liquid to about 1 cup total, about 10 minutes.
The braise: Place the shanks in the pot so that they are sitting with the exposed bone facing up, and pour over any juices that accumulated as they sat. Cover with parchment paper, pressing down so the parchment nearly touches the veal and the edges hang over the sides of the pot by about an inch. Cover tightly with the lid, and slide into the lower part of the oven to braise at a gentle simmer. Check the pot after the first 15 minutes, and if the liquid is simmering too aggressively, lower the oven heat by 10 or 15 degrees. Continue braising, turning the shanks and spooning some pan juices over the top after the first 40 minutes, until the meat is completely tender and pulling away from the bone, about 2 hours.
The gremolata: While the shanks are braising, stir together the garlic, parsley, and lemon zest in a small bowl. Cover with plastic wrap and set aside in a cool place (or the refrigerator, if your kitchen is very warm.)
The finish: When the veal is fork-tender and falling away from the bone, remove the lid and sprinkle over half of the gremolata. Return the veal to the oven, uncovered, for another 15 minutes to caramelize it some.
Using a slotted spatula or spoon, carefully lift the shanks from the braising liquid, doing your best to keep them intact. The shanks will be very tender and threatening to fall into pieces, and the marrow will be wobbly inside the bones, so this can be a bit tricky. But if they do break apart, don’t worry, the flavor won’t suffer at all. Arrange the shanks on a serving platter or other large plate, without stacking, and cover with foil to keep warm.
Finishing the sauce: Set the braising pot on top of the stove and evaluate the sauce: if there is a visible layer of fat floating on the surface, use a large spoon to skim it off and discard it. Taste the sauce for concentration of flavor. If it tastes a bit weak or flat, bring it to a boil over high heat, and boil to reduce the volume and intensify the flavor for 5 to 10 minutes. Taste again for salt and pepper. If the sauce wants more zip, stir in a teaspoon or two of the remaining gremolata.
Portioning the veal shanks: if the shanks are reasonably sized, serve one per person. If the shanks are gargantuan or you’re dealing with modest appetites, pull apart the larger shanks, separating them at their natural seams, and serve smaller amounts. Be sure to give the marrow bones to whomever prizes them most.
Serving: Arrange the veal shanks on warm dinner plates accompanied by the risotto, if serving. Just before carrying the plates to the table, sprinkle on the remaining gremolata and then spoon over a generous amount of sauce – the contact with the hot liquid will aromatize the gremolata and perk up everyone’s appetite with the whiff of garlic and lemon.",,,TheMealDB,https://www.themealdb.com/images/media/meals/wwuqvt1487345467.jpg
Chilli prawn linguine,280g Linguine Pasta | 200g Sugar Snap Peas | 2 tblsp  Olive Oil | 2 cloves chopped Garlic Clove | 1 large Red Chilli | 24 Skinned King Prawns | 12 Cherry Tomatoes | Handful Basil Leaves | Leaves Lettuce | to serve Bread | 2 tbsp Fromage Frais | Grated Zest of 2 Lime | 2 tsp Caster Sugar,"Mix the dressing ingredients in a small bowl and season with salt and pepper. Set aside.

Cook the pasta according to the packet instructions. Add the sugar snap peas for the last minute or so of cooking time.

Meanwhile, heat the oil in a wok or large frying pan, toss in the garlic and chilli and cook over a fairly gentle heat for about 30 seconds without letting the garlic brown. Tip in the prawns and cook over a high heat, stirring frequently, for about 3 minutes until they turn pink.

Add the tomatoes and cook, stirring occasionally, for 3 minutes until they just start to soften. Drain the pasta and sugar snaps well, then toss into the prawn mixture. Tear in the basil leaves, stir, and season with salt and pepper.

Serve with salad leaves drizzled with the lime dressing, and warm crusty bread.",,,TheMealDB,https://www.themealdb.com/images/media/meals/usywpp1511189717.jpg
Fettuccine Alfredo,1 lb Fettuccine | 1/2 cup  Heavy Cream | 1/2 cup  Butter | 1/2 cup  Parmesan | 2 tbsp Parsley | Black Pepper,"Cook pasta according to package instructions in a large pot of boiling water and salt. Add heavy cream and butter to a large skillet over medium heat until the cream bubbles and the butter melts. Whisk in parmesan and add seasoning (salt and black pepper). Let the sauce thicken slightly and then add the pasta and toss until coated in sauce. Garnish with parsley, and it's ready.",,,TheMealDB,https://www.themealdb.com/images/media/meals/0jv5gx1661040802.jpg
Fettucine alfredo,227g Clotted Cream | 25g Butter | 1 tsp  Corn Flour | 100g  Parmesan Cheese | Grated Nutmeg | 250g Fettuccine | Chopped Parsley,"In a medium saucepan, stir the clotted cream, butter and cornflour over a low-ish heat and bring to a low simmer. Turn off the heat and keep warm.
Meanwhile, put the cheese and nutmeg in a small bowl and add a good grinding of black pepper, then stir everything together (don’t add any salt at this stage).
Put the pasta in another pan with 2 tsp salt, pour over some boiling water and cook following pack instructions (usually 3-4 mins). When cooked, scoop some of the cooking water into a heatproof jug or mug and drain the pasta, but not too thoroughly.
Add the pasta to the pan with the clotted cream mixture, then sprinkle over the cheese and gently fold everything together over a low heat using a rubber spatula. When combined, splash in 3 tbsp of the cooking water. At first, the pasta will look wet and sloppy: keep stirring until the water is absorbed and the sauce is glossy. Check the seasoning before transferring to heated bowls. Sprinkle over some chives or parsley, then serve immediately.",,,TheMealDB,https://www.themealdb.com/images/media/meals/uquqtu1511178042.jpg
Grilled Mac and Cheese Sandwich,8 ounces (230 grams) Macaroni | 1/3 cup Plain Flour | 3/4 teaspoon Mustard Powder | 1/2 teaspoon Garlic powder | 1/2 teaspoon Kosher salt | 1/2 teaspoon Black pepper | 1/8 teaspoon Cayenne pepper | 6 tablespoons (85 grams) Butter | 1 1/2 cups (360 milliliters) Whole Milk | 1 cup (240 milliliters) Heavy Cream | 1 pound (455 grams)  Monterey Jack Cheese | 4 tablespoons (55 grams) Butter | 1 teaspoon garlic powder | 16 slices square Bread | 8 slices mild Cheddar Cheese | 8 slices Colby Jack Cheese | 4 tablespoons (55 grams) Butter,"Make the mac and cheese

1. Bring a medium saucepan of generously salted water (you want it to taste like seawater) to a boil. Add the pasta and cook, stirring occasionally, until al dente, 8 to 10 minutes, or according to the package directions. The pasta should be tender but still chewy.
2. While the pasta is cooking, in a small bowl, whisk together the flour, mustard powder, garlic powder, salt, black pepper, and cayenne pepper.
3. Drain the pasta in a colander. Place the empty pasta pan (no need to wash it) over low heat and add the butter. When the butter has melted, whisk in the flour mixture and continue to cook, whisking frequently, until the mixture is beginning to brown and has a pleasant, nutty aroma, about 1 minute. Watch carefully so it does not scorch on the bottom of the pan.
4. Slowly whisk the milk and cream into the flour mixture until everything is really well combined. Cook, whisking constantly, until the sauce is heated through and just begins to thicken, about 2 minutes. Remove from the heat. Gradually add the cheese while stirring constantly with a wooden spoon or silicone spatula and keep stirring until the cheese has melted into the sauce. Then stir in the drained cooked pasta.
5. Line a 9-by-13-inch (23-by-33-centimeter) rimmed baking sheet with parchment paper or aluminum foil. Coat the paper or foil with nonstick cooking spray or slick it with butter. Pour the warm mac and cheese onto the prepared baking sheet and spread it evenly with a spatula. Coat another piece of parchment paper with cooking spray or butter and place it, oiled or buttered side down, directly on the surface of the mac and cheese. Refrigerate until cool and firm, about 1 hour.

Make the grilled cheese
6. Heat a large cast-iron or nonstick skillet over medium-low heat.
7. In a small bowl, stir together the 4 tablespoons (55 grams) butter and garlic powder until well blended.
8. Remove the mac and cheese from the refrigerator and peel off the top layer of parchment paper. Carefully cut into 8 equal pieces. Each piece will make 1 grilled mac and cheese sandwich. (You can stash each individual portion in a double layer of resealable plastic bags and refrigerate for up to 3 days or freeze it for up to 1 month.)
9. Spread 3/4 teaspoon garlic butter on one side of each bread slice. Place half of the slices, buttered-side down, on a clean cutting board. Top each with one slice of Cheddar, then 1 piece of the mac and cheese. (Transfer from the baking sheet by scooting your hand or a spatula under each piece of mac and cheese and then flipping it over onto a sandwich.) Place 1 slice of Jack on top of each. Finish with the remaining bread slices, buttered-side up.
10. Using a wide spatula, place as many sandwiches in the pan as will fit without crowding it. Cover and cook until the bottoms are nicely browned, about 4 minutes. Turn and cook until the second sides are browned, the cheese is melted, and the mac and cheese is heated through, about 4 minutes more.
11. Repeat with the remaining ingredients. Cut the sandwiches in half, if desired, and serve.",,,TheMealDB,https://www.themealdb.com/images/media/meals/xutquv1505330523.jpg
Lasagna Sandwiches,1/4 cup Sour Cream | 2 tbs Chopped Onion | 1/2 tbs Dried Oregano | 1/4 tsp Salt | 8 slices Bread | 8 slices Bacon | 8 slices Tomato | 4 slices Mozzarella | 2 1/2 Tbs Butter,"1. In a small bowl, combine the first four ingredients; spread on four slices of bread. Layer with bacon, tomato and cheese; top with remaining bread.

2. In a large skillet or griddle, melt 2 tablespoons butter. Toast sandwiches until lightly browned on both sides and cheese is melted, adding butter if necessary.

Nutrition Facts
1 sandwich: 445 calories, 24g fat (12g saturated fat), 66mg cholesterol, 1094mg sodium, 35g carbohydrate (3g sugars, 2g fiber), 21g protein.",,,TheMealDB,https://www.themealdb.com/images/media/meals/xr0n4r1576788363.jpg
Lasagne,1 tblsp  Olive Oil | 2 Bacon | 1 finely chopped  Onion | 1 Stick Celery | 1 medium Carrots | 2 cloves chopped Garlic | 500g Minced Beef | 1 tbls Tomato Puree | 800g Chopped Tomatoes | 1 tblsp  Honey | 500g Lasagne Sheets | 400ml Creme Fraiche | 125g Mozzarella Balls | 50g Parmesan Cheese | Topping Basil Leaves,"Heat the oil in a large saucepan. Use kitchen scissors to snip the bacon into small pieces, or use a sharp knife to chop it on a chopping board. Add the bacon to the pan and cook for just a few mins until starting to turn golden. Add the onion, celery and carrot, and cook over a medium heat for 5 mins, stirring occasionally, until softened.
Add the garlic and cook for 1 min, then tip in the mince and cook, stirring and breaking it up with a wooden spoon, for about 6 mins until browned all over.
Stir in the tomato purée and cook for 1 min, mixing in well with the beef and vegetables. Tip in the chopped tomatoes. Fill each can half full with water to rinse out any tomatoes left in the can, and add to the pan. Add the honey and season to taste. Simmer for 20 mins.
Heat oven to 200C/180C fan/gas 6. To assemble the lasagne, ladle a little of the ragu sauce into the bottom of the roasting tin or casserole dish, spreading the sauce all over the base. Place 2 sheets of lasagne on top of the sauce overlapping to make it fit, then repeat with more sauce and another layer of pasta. Repeat with a further 2 layers of sauce and pasta, finishing with a layer of pasta.
Put the crème fraîche in a bowl and mix with 2 tbsp water to loosen it and make a smooth pourable sauce. Pour this over the top of the pasta, then top with the mozzarella. Sprinkle Parmesan over the top and bake for 25–30 mins until golden and bubbling. Serve scattered with basil, if you like.",,,TheMealDB,https://www.themealdb.com/images/media/meals/wtsvxx1511296896.jpg
Pilchard puttanesca,300g Spaghetti | 1 tbls Olive Oil | 1 finely chopped  Onion | 2 cloves minced Garlic | 1 Red Chilli | 1 tbls Tomato Puree | 425g Pilchards | 70g Black Olives | Shaved Parmesan,"Cook the pasta following pack instructions. Heat the oil in a non-stick frying pan and cook the onion, garlic and chilli for 3-4 mins to soften. Stir in the tomato purée and cook for 1 min, then add the pilchards with their sauce. Cook, breaking up the fish with a wooden spoon, then add the olives and continue to cook for a few more mins.

Drain the pasta and add to the pan with 2-3 tbsp of the cooking water. Toss everything together well, then divide between plates and serve, scattered with Parmesan.",,,TheMealDB,https://www.themealdb.com/images/media/meals/vvtvtr1511180578.jpg
